"year","title","authors","source","volume","issue","doi","document_type","language","country_orig","country","iso3"
1993,"EFFECTS OF ALGAL BLOOMS ON SHELLFISH BIOLOGY AND METABOLISM","MARSDEN, ID","Marine Toxins and New Zealand Shellfish","24",NA,NA,"Proceedings Paper","English",NA,NA,NA
2015,"Bioaccumulation of rnicrocystins in invasive bivalves: A case study from the boreal lagoon ecosystem","Paldaviciene, A; Zaiko, A; Mazur-Marzec, H; Razinkovas-Baziukas, A","Oceanologia","57","1","10.1016/j.oceano.2014.10.001","Article","English","Lithuania","Lithuania","LTU"
2016,"An investigation into ciguatoxin bioaccumulation in sharks","Meyer, L; Capper, A; Carter, S; Simpfendorfer, C","Toxicon","119",NA,"10.1016/j.toxicon.2016.06.007","Article","English","Australia","Australia","AUS"
2004,"Brevetoxin metabolism and elimination in the Eastern oyster (Crassostrea virginica) after controlled exposures to Karenia brevis","Plakas, SM; Wang, ZH; El Said, KR; Jester, ELE; Granade, HR; Flewelling, L; Scott, P; Dickey, RW","Toxicon","44","6","10.1016/j.toxicon.2004.07.027","Article","English","FL 33701 USA","United States","USA"
2013,"Management of domoic acid monitoring in shellfish from the Catalan coast","Papiol, GG; Casanova, A; Fernández-Tejedor, M; de la Iglesia, P; Diogène, J","Environmental Monitoring and Assessment","185","8","10.1007/s10661-012-3054-6","Article","English","Spain","Spain","ESP"
2013,"Toxicokinetics of polybrominated diphenyl ethers across life stages in the northern leopard frog (Lithobates pipiens)","Cary, TL; Karasov, WH","Environmental Toxicology and Chemistry","32","7","10.1002/etc.2215","Article","English","WI 53706 USA","United States","USA"
2020,"The presence of microcystins in the coastal waters of Nigeria, from the Bights of Bonny and Benin, Gulf of Guinea","Kadiri, MO; Isagba, S; Ogbebor, JU; Omoruyi, OA; Unusiotame-Owolagba, TE; Lorenzi, AS; Bittencourt-Oliveira, MD; Chia, MA","Environmental Science and Pollution Research","27","28","10.1007/s11356-020-09740-x","Article","English","Nigeria","Nigeria","NGA"
2008,"Accumulation of domoic acid and its effect on juvenile king scallop Pecten maximus (Linnaeus, 1758)","Liu, H; Kelly, MS; Campbell, DA; Fang, JG; Zhu, JX","Aquaculture","284","1-4","10.1016/j.aquaculture.2008.07.003","Article","English","Peoples R China","China","CHN"
2013,"Interannual variability in the timing of New England shellfish toxicity and relationships to environmental forcing","Nair, A; Thomas, AC; Borsuk, ME","Science of The Total Environment","447",NA,"10.1016/j.scitotenv.2013.01.023","Article","English","NH 03755 USA","United States","USA"
2021,"Distribution of Tetrodotoxin in Pacific Oysters (Crassostrea gigas)","Dhanji-Rapkova, M; Turner, AD; Baker-Austin, C; Huggett, JF; Ritchie, JM","Marine Drugs","19","2","10.3390/md19020084","Article","English","England",NA,NA
2018,"Accumulation and transformation of azaspiracids in scallops (Chlamys farreri) and mussels (Mytilus galloprovincialis) fed with Azadinium poporum, and response of antioxidant enzymes","Ji, Y; Qiu, JB; Xie, T; McCarron, P; Li, AF","Toxicon","143",NA,"10.1016/j.toxicon.2017.12.040","Article","English","Peoples R China","China","CHN"
2009,"Modelling as a mitigation strategy for harmful algal blooms","Blanco, J","Shellfish Safety and Quality",NA,"167",NA,"Article; Book Chapter","English","Spain","Spain","ESP"
1993,"DOMOIC ACID IN THE PACIFIC RAZOR CLAM SILIQUA-PATULA (DIXON, 1789)","DRUM, AS; SIEBENS, TL; CRECELIUS, EA; ELSTON, RA","Journal of Shellfish Research","12","2",NA,"Article","English",NA,NA,NA
2005,"Colonization of shellfish by pathogenic Vibrios","Paranjpye, RN; Strom, MS","Oceans 2005, Vols 1-3",NA,NA,NA,"Proceedings Paper","English","WA 98112 USA","United States","USA"
2023,"Feeding behavior, microcystin accumulation, biochemical response, and ultramicrostructure changes in edible freshwater bivalve Corbicula fluminea exposed to Microcystis aeruginosa","Zhang, JX; Yu, M; Gao, YN; Zhang, M; Dong, J; Li, M; Li, XJ","Environmental Science and Pollution Research","30","5","10.1007/s11356-022-22833-z","Article","English","Peoples R China","China","CHN"
2007,"Spatial variability of domoic acid concentration in king scallops Pecten maximus off the southeast coast of Ireland","Bogan, YM; Bender, K; Hervas, A; Kennedy, DJ; Slater, JW; Hess, P","Harmful Algae","6","1","10.1016/j.hal.2006.05.004","Article","English","Ireland","Ireland","IRL"
1993,"BIOACCUMULATIVE POTENTIAL AND TOXICITY OF ENDOSULFAN INSECTICIDE TO NONTARGET ANIMALS","NAQVI, SM; VAISHNAVI, C","Comparative Biochemistry and Physiology C-Toxicology and Pharmacology","105","3","10.1016/0742-8413(93)90071-R","Review","English","INDIA","India","IND"
2015,"Identifying best methods for routine ELISA detection of microcystin in seafood","Preece, EP; Moore, BC; Swanson, ME; Hardy, FJ","Environmental Monitoring and Assessment","187","2","10.1007/s10661-014-4255-y","Article","English","WA 99164 USA","United States","USA"
2022,"First observation of domoic acid and its isomers in shellfish samples from Shandong Province, China","Zheng, GC; Wu, HY; Guo, MM; Peng, JX; Zhai, YX; Tan, ZJ","Journal of Oceanology and Limnology","40","6","10.1007/s00343-022-2104-3","Article","English","Peoples R China","China","CHN"
2022,"Residue Analysis and Assessment of the Risk of Dietary Exposure to Domoic Acid in Shellfish from the Coastal Areas of China","Zheng, GC; Wu, HY; Che, HY; Li, XK; Zhang, ZH; Peng, JX; Guo, MM; Tan, ZJ","Toxins","14","12","10.3390/toxins14120862","Article","English","Peoples R China","China","CHN"
2024,"Why are bivalves not detoxified?","Leal, JF; Cristiano, MLS","Current Opinion in Food Science","57",NA,"10.1016/j.cofs.2024.101162","Article","English","Portugal","Portugal","PRT"
2008,"Detoxification of the oyster Crassostrea gigas contaminated with paralytic shellfish poison (PSP) by cultivation in filtered seawater","Takata, K; Takatsuji, H; Seno, M","Nippon Suisan Gakkaishi","74","1","10.2331/suisan.74.78","Article","Japanese","Japan","Japan","JPN"
2016,"Evidence of rapid transfer and bioaccumulation of Microcystin-LR poses potential risk to freshwater prawn Macrobrachium rosenbergii (de Man)","Liu, LP; Su, XM; Chen, TY; Li, K; Zhan, J; Egna, H; Diana, J","Aquaculture Research","47","10","10.1111/are.12759","Article","English","Peoples R China","China","CHN"
2011,"Dynamics of Protein Phosphatase Gene Expression in Corbicula fluminea Exposed to Microcystin-LR and to Toxic Microcystis aeruginosa Cells","Martins, JC; Machado, J; Martins, A; Azevedo, J; OlivaTeles, L; Vasconcelos, V","International Journal of Molecular Sciences","12","12","10.3390/ijms12129172","Article","English","Portugal","Portugal","PRT"
2016,"Size-dependent changes in toxicity of Perna viridis mussels exposed to natural populations of Pyrodinium bahamense var. compressum","Rañada, MLO; Tabbada, RSD; Mendoza, ADL; Relox, J; Sombrito, EZ","Regional Studies in Marine Science","3",NA,"10.1016/j.rsma.2015.07.007","Article","English","Philippines","Philippines","PHL"
